{
  "$schema": "../schemas/empirical_quant_workflow.v1.schema.json",
  "schema_version": "empirical_quant_workflow.v1",
  "updated_at": "2026-05-27",
  "policy": "Quantitative social-science work is controlled by research question, estimand, identification, diagnostics, robustness, transparent code, and bounded writing. External econometrics and de-AIGC skills provide patterns, but they do not replace the local route, citation, data, figure, writing, or reproducibility gates.",
  "source_review_refs": [
    {
      "upstream": "brycewang-stanford/Awesome-Agent-Skills-for-Empirical-Research",
      "repo_url": "https://github.com/brycewang-stanford/Awesome-Agent-Skills-for-Empirical-Research",
      "commit": "e03ff8cf62f1ce8739c4181cead149da5dd84b11",
      "adopted_as": [
        "AER identification-first sequence before manuscript prose",
        "modern causal design families and referee-facing diagnostics",
        "full empirical analysis loop for Python, R, and Stata style projects",
        "robustness, heterogeneity, mechanism, placebo, and sensitivity matrix",
        "replication package and README-first discipline",
        "academic de-AI writing audit as claim-preserving surface cleanup",
        "AER skills decision tree for RCT, RDD, DID, IV, shift-share, SCM, mechanism, and replication design choice",
        "Stata do-file ecosystem conventions including master runner, package installer, diagnostics, logs, and table/figure exports",
        "academic humanization usage pattern: detect first, rewrite second, second-pass audit, no detector-bypass promise"
      ],
      "not_adopted": [
        "bulk installing all external empirical or humanizer skills into runtime",
        "using AER or economics top-5 standards as default for all social-science papers",
        "using StatsPAI or any DSL as a black box without explicit audit artifacts",
        "guaranteeing detector bypass or editing to hide unreviewed AI-generated scholarship",
        "copying external templates as verified methods or references",
        "treating a de-AIGC score or detector number as the formal quality target",
        "using Stata package lists without project-specific design, data, and replication checks"
      ]
    }
  ],
  "adoption_options": [
    {
      "id": "option_a_direct_install_external_skills",
      "label": "Directly install AER, StatsPAI, and humanizer skills",
      "decision": "reject_as_default",
      "description": "Direct installation would expose many overlapping writing and routing triggers, making Codex choose between duplicate humanization, writing, and quant skills.",
      "strengths": [
        "fast to expose upstream instructions",
        "keeps upstream language close to source"
      ],
      "risks": [
        "duplicates manuscript-writing-studio and writing-quality gates",
        "imports economics top-5 conventions as too broad a default",
        "can make detector-oriented language look like a separate objective"
      ]
    },
    {
      "id": "option_b_contract_first_empirical_quant_integration",
      "label": "Adapt into local empirical quant contract",
      "decision": "selected",
      "description": "Encode useful upstream methods as a local schema, catalog, validator, quant skill, route rule, and quality gate while preserving research-autopilot as the only router.",
      "strengths": [
        "keeps identification, robustness, writing, figures, and replication under one local chain",
        "makes causal method choice and diagnostics reviewable",
        "lets English AER patterns remain optional instead of universal",
        "prevents humanization from changing facts, claims, citations, or uncertainty"
      ],
      "risks": [
        "requires validator upkeep when new methods are added",
        "does not expose every external helper command immediately"
      ]
    },
    {
      "id": "option_c_optional_statspai_runtime",
      "label": "Keep StatsPAI as optional future runtime",
      "decision": "watch",
      "description": "StatsPAI may be useful for fast exploratory causal workflows, but it needs separate local installation, API smoke tests, and result audit before becoming a default tool.",
      "strengths": [
        "could speed up exploratory model routing",
        "self-describing function API may help agent use"
      ],
      "risks": [
        "DSL output can hide modeling decisions",
        "local projects still need transparent scripts for reviewers and collaborators",
        "package version drift can change results"
      ]
    },
    {
      "id": "option_d_no_change",
      "label": "Leave quant analysis as a short runtime skill",
      "decision": "reject_as_default",
      "description": "The existing short quant-analysis skill names minimum inputs but does not encode modern identification, diagnostics, robustness, or replication contracts.",
      "strengths": [
        "low maintenance",
        "simple instructions"
      ],
      "risks": [
        "causal claims remain under-specified",
        "robustness and replication are easy to postpone",
        "writing and figure outputs can drift away from the empirical design"
      ]
    }
  ],
  "selected_strategy": "option_b_contract_first_empirical_quant_integration",
  "workflow_modes": [
    {
      "id": "empirical_question_intake",
      "label": "量化研究问题和估计目标澄清",
      "trigger_signals": [
        "量化研究",
        "实证分析",
        "回归",
        "因果识别",
        "计量",
        "empirical quant"
      ],
      "required_inputs": [
        "research_question",
        "unit_of_analysis",
        "sample_definition",
        "outcome_variable",
        "main_explanatory_variable",
        "estimand_or_descriptive_goal"
      ],
      "required_steps": [
        "declare whether the task is descriptive, predictive, associational, or causal",
        "state the estimand or the statistic before selecting a model",
        "record sample, time window, unit, treatment, outcome, controls, and clustering level",
        "ask for missing design information before causal wording"
      ],
      "outputs": [
        "empirical question card",
        "estimand and variable map",
        "missing inputs or blocker list"
      ]
    },
    {
      "id": "identification_strategy_audit",
      "label": "识别策略审计",
      "trigger_signals": [
        "DID",
        "IV",
        "RDD",
        "PSM",
        "SCM",
        "DML",
        "事件研究",
        "工具变量",
        "断点回归",
        "识别策略",
        "staggered DID",
        "Sun-Abraham",
        "Callaway SantAnna",
        "Borusyak Jaravel Spiess",
        "de Chaisemartin",
        "weak IV",
        "Anderson-Rubin",
        "shift-share",
        "Bartik",
        "DDD",
        "triple difference",
        "synthetic DID",
        "generalized synthetic control",
        "field experiment",
        "RCT",
        "mediation",
        "mechanism",
        "dose response",
        "continuous treatment",
        "causal forest",
        "CATE"
      ],
      "required_inputs": [
        "estimand_or_target_parameter",
        "candidate_design_family",
        "assignment_or_treatment_process",
        "identifying_assumptions",
        "available_diagnostics"
      ],
      "required_steps": [
        "select a design family from design_families",
        "write the identifying assumption in one plain sentence",
        "run the design family's required diagnostics before prose polishing",
        "mark old defaults such as naive TWFE, first-stage F > 10, or high-order RDD polynomials as red flags",
        "use the design decision tree before model selection: randomized assignment, threshold, timing shock, instrument, shift-share exposure, matched observables, synthetic control, or non-causal descriptive boundary",
        "for staggered DID, reject naive TWFE as the only estimator and require modern cohort, imputation, or interaction-weighted checks",
        "for weak IV risk, require weak-IV robust inference or downgrade the causal claim",
        "for shift-share designs, declare whether identification comes from exogenous shares or exogenous shocks and audit Rotemberg weights or shock-level inference"
      ],
      "outputs": [
        "identification audit",
        "red-flag list",
        "next robustness plan"
      ]
    },
    {
      "id": "full_empirical_pipeline",
      "label": "完整实证分析链",
      "trigger_signals": [
        "从清洗到建模",
        "一条龙实证",
        "完整实证",
        "full empirical analysis",
        "analysis pipeline",
        "Stata",
        "do file",
        "reghdfe",
        "csdid",
        "ivreg2",
        "rdrobust",
        "esttab",
        "stata python replication"
      ],
      "required_inputs": [
        "raw_or_clean_data_path",
        "analysis_question",
        "data_dictionary",
        "code_language_preference",
        "output_format"
      ],
      "required_steps": [
        "clean data and record merge validation",
        "construct variables and declare transformations",
        "run descriptives and diagnostic checks",
        "estimate the selected model family",
        "run robustness, heterogeneity, mechanism, and sensitivity checks",
        "produce figure, table, interpretation, and reproducibility artifacts",
        "if Stata is used, create or inspect a master do-file pipeline with relative paths, package installation, logs, deterministic seeds, and table/figure output folders",
        "store Stata outputs beside scripts and logs so the reviewer can trace every table or figure back to a command file"
      ],
      "outputs": [
        "analysis log",
        "tables and figures",
        "interpretation note",
        "reproducibility checklist"
      ]
    },
    {
      "id": "robustness_and_sensitivity",
      "label": "稳健性和敏感性矩阵",
      "trigger_signals": [
        "稳健性",
        "异质性",
        "机制",
        "安慰剂",
        "敏感性",
        "robustness",
        "placebo"